{
  "_meta": {
    "description": "BudgetBuddy 可用模型目录与三平台（CodeBuddy/OpenCode/Claude Code）三档预设配置",
    "update_command": "budget setup models",
    "updated_at": "2026-10-20"
  },
  "aliases": {
    "codex": "gpt-5.3-codex",
    "deepseek": "deepseek-v3.2",
    "gemini-flash": "gemini-3.5-flash",
    "gemini-pro": "gemini-3.1-pro",
    "glm": "glm-5.2",
    "gpt": "gpt-5.4",
    "haiku": "claude-haiku-4.5",
    "kimi": "kimi-k2.7",
    "kimi-code": "kimi-k2.7",
    "opus": "claude-opus-4.8-1m",
    "opus-4.6": "claude-opus-4.6-1m",
    "opus-4.7": "claude-opus-4.7-1m",
    "opus-4.8": "claude-opus-4.8-1m",
    "sonnet": "claude-sonnet-4.6-1m",
    "sonnet-4.6": "claude-sonnet-4.6-1m"
  },
  "models": {
    "free": {
      "hunyuan": [
        {
          "cost": "x0.00",
          "id": "hy3",
          "note": "SWE-bench Verified 78.0%、GPQA 90.4%，免费模型中综合能力最强",
          "platform": [
            "codebuddy"
          ],
          "recommended_for": [
            "coder_lite",
            "tester",
            "recorder"
          ],
          "tags": [
            "general",
            "agent",
            "reasoning"
          ],
          "tier": "free"
        },
        {
          "cost": "x0.00",
          "id": "hunyuan-2.0-thinking",
          "platform": [
            "codebuddy"
          ],
          "tags": [
            "reasoning"
          ],
          "tier": "free"
        }
      ],
      "kimi": [
        {
          "cost": "x0.00",
          "id": "kimi-k2.5",
          "platform": [
            "codebuddy"
          ],
          "recommended_for": [
            "tester"
          ],
          "tags": [
            "general",
            "agent"
          ],
          "tier": "free"
        }
      ],
      "opencode": [
        {
          "cost": "x0.00",
          "id": "deepseek-v4.1-flash-free",
          "note": "OpenCode 官方免费系，经本机 opencode models 核对存在",
          "platform": [
            "opencode"
          ],
          "tags": [
            "code",
            "fast"
          ],
          "tier": "free"
        },
        {
          "cost": "x0.00",
          "id": "glm-5.3-flash-free",
          "note": "OpenCode 官方免费系，经本机 opencode models 核对存在",
          "platform": [
            "opencode"
          ],
          "tags": [
            "general",
            "fast"
          ],
          "tier": "free"
        }
      ]
    },
    "paid": {
      "claude": [
        {
          "cost": "x3.50",
          "id": "claude-opus-5-5",
          "note": "官方 Claude Code 默认模型（$4/百万输入），2026-09-22 发布；经本机 Claude Code 2.1.304 实测核对（2026-10-20）",
          "platform": [
            "claudecode"
          ],
          "tags": [
            "reasoning"
          ],
          "tier": "top"
        },
        {
          "cost": "x3.50",
          "id": "claude-opus-4.8",
          "platform": [
            "codebuddy",
            "opencode",
            "claudecode"
          ],
          "tags": [
            "reasoning"
          ],
          "tier": "top"
        },
        {
          "cost": "x3.50",
          "id": "claude-opus-4.8-1m",
          "platform": [
            "codebuddy",
            "opencode",
            "claudecode"
          ],
          "tags": [
            "reasoning",
            "long-context"
          ],
          "tier": "top"
        },
        {
          "cost": "x3.33",
          "id": "claude-opus-4.7-1m",
          "platform": [
            "codebuddy",
            "opencode",
            "claudecode"
          ],
          "tags": [
            "reasoning",
            "long-context"
          ],
          "tier": "top"
        },
        {
          "cost": "x3.33",
          "id": "claude-opus-4.7",
          "platform": [
            "codebuddy",
            "opencode",
            "claudecode"
          ],
          "tags": [
            "reasoning"
          ],
          "tier": "top"
        },
        {
          "cost": "x3.33",
          "id": "claude-opus-4.6-1m",
          "platform": [
            "codebuddy",
            "opencode",
            "claudecode"
          ],
          "tags": [
            "reasoning",
            "long-context"
          ],
          "tier": "top"
        },
        {
          "cost": "x3.33",
          "id": "claude-opus-4.6",
          "platform": [
            "codebuddy",
            "opencode",
            "claudecode"
          ],
          "tags": [
            "reasoning"
          ],
          "tier": "top"
        },
        {
          "cost": "x2.00",
          "id": "claude-sonnet-5-5",
          "note": "2026-09-28 发布（$2/$10 定价）；经本机 Claude Code 2.1.304 实测核对（2026-10-20）",
          "platform": [
            "claudecode"
          ],
          "tags": [
            "general"
          ],
          "tier": "mid"
        },
        {
          "cost": "x2.00",
          "id": "claude-sonnet-4.6-1m",
          "platform": [
            "codebuddy",
            "opencode",
            "claudecode"
          ],
          "tags": [
            "general",
            "long-context"
          ],
          "tier": "mid"
        },
        {
          "cost": "x2.00",
          "id": "claude-sonnet-4.6",
          "platform": [
            "codebuddy",
            "opencode",
            "claudecode"
          ],
          "tags": [
            "general"
          ],
          "tier": "mid"
        },
        {
          "cost": "x0.67",
          "id": "claude-haiku-5-5",
          "note": "2026-10-07 发布；经本机 Claude Code 2.1.304 实测核对（2026-10-20）",
          "platform": [
            "claudecode"
          ],
          "tags": [
            "fast"
          ],
          "tier": "budget"
        },
        {
          "cost": "x0.67",
          "id": "claude-haiku-4.5",
          "platform": [
            "codebuddy",
            "opencode",
            "claudecode"
          ],
          "tags": [
            "fast"
          ],
          "tier": "budget"
        }
      ],
      "deepseek": [
        {
          "cost": "x0.13",
          "id": "deepseek-v4-pro",
          "note": "SWE-bench 80.6%、LiveCodeBench 93.5%、1M context，性价比极高，经本机 opencode models 核对存在",
          "platform": [
            "codebuddy",
            "opencode"
          ],
          "recommended_for": [
            "coder_senior",
            "coder_standard",
            "architect",
            "reviewer"
          ],
          "tags": [
            "code",
            "agent",
            "reasoning",
            "long-context"
          ],
          "tier": "mid"
        },
        {
          "cost": "x0.05",
          "id": "deepseek-v4-flash",
          "note": "SWE-bench 79.0%、1M context，极低价格",
          "platform": [
            "codebuddy"
          ],
          "recommended_for": [
            "coder_standard",
            "coder_lite"
          ],
          "tags": [
            "code",
            "fast",
            "long-context"
          ],
          "tier": "budget"
        },
        {
          "cost": "x0.15",
          "id": "deepseek-v3.2",
          "note": "旧版，建议升级到 V4",
          "platform": [
            "codebuddy"
          ],
          "tags": [
            "general"
          ],
          "tier": "budget"
        },
        {
          "cost": "x0.05",
          "id": "deepseek-flash",
          "note": "OpenCode deepseek provider 的 flash 系 ID（与 deepseek-v4-flash 同代），经本机核对存在",
          "platform": [
            "opencode"
          ],
          "tags": [
            "code",
            "fast",
            "long-context"
          ],
          "tier": "budget"
        }
      ],
      "gemini": [
        {
          "cost": "x0.99",
          "id": "gemini-3.5-flash",
          "note": "Terminal-Bench 76.2%、MCP Atlas 83.6%、Agent Elo 1656",
          "platform": [
            "codebuddy",
            "opencode"
          ],
          "recommended_for": [
            "tester"
          ],
          "tags": [
            "agent",
            "tool-use",
            "fast"
          ],
          "tier": "mid"
        },
        {
          "cost": "x0.90",
          "id": "gemini-2.5-pro",
          "note": "已弃用：路由稳定性问题，不推荐用作 agent 模型",
          "platform": [
            "codebuddy",
            "opencode"
          ],
          "tags": [
            "reasoning"
          ],
          "tier": "mid"
        },
        {
          "cost": "x1.32",
          "id": "gemini-3.1-pro",
          "platform": [
            "codebuddy",
            "opencode"
          ],
          "tags": [
            "general"
          ],
          "tier": "mid"
        }
      ],
      "glm": [
        {
          "cost": "x1.06",
          "id": "glm-5.2",
          "note": "开源系最强文本模型之一：Terminal-Bench 81%、SWE-bench Pro 62.1%、1M context",
          "platform": [
            "codebuddy",
            "opencode"
          ],
          "recommended_for": [
            "architect",
            "coder_senior",
            "reviewer"
          ],
          "tags": [
            "code",
            "agent",
            "reasoning",
            "long-context"
          ],
          "tier": "top"
        },
        {
          "cost": "x0.90",
          "id": "glm-5.1",
          "note": "已被 GLM-5.2 大幅超越，建议升级",
          "platform": [
            "codebuddy",
            "opencode"
          ],
          "tags": [
            "code",
            "agent"
          ],
          "tier": "mid"
        },
        {
          "cost": "x0.81",
          "id": "glm-5v-turbo",
          "note": "多模态视觉编程基座，适合设计稿转代码与 UI 截图分析场景",
          "platform": [
            "codebuddy",
            "opencode"
          ],
          "tags": [
            "multimodal",
            "code",
            "tool-use"
          ],
          "tier": "light"
        },
        {
          "cost": "x0.68",
          "id": "glm-5.0",
          "platform": [
            "codebuddy",
            "opencode"
          ],
          "tags": [
            "general"
          ],